{"$id":"https://example.org/schemas/drift_event.schema.json","$schema":"https://json-schema.org/draft/2020-12/schema","$title":"Configuration drift event","additionalProperties":true,"description":"Configuration drift events produced by Ansible audit jobs when observed device state differs from the golden model. Mirrors the repository's real drift artifact keys (host, vlans, switchports, acls, bindings). Audit jobs emit both a human-readable result and a structured JSON event; an external SIEM consumes the JSON for drift alerting. Enforcement behavior is unchanged: remediation only happens in enforce mode with a change ticket. External SIEM transmission is disabled by default.","properties":{"configuration_object":{"description":"Required. The configuration object that drifted, for example switchport_access_vlan or vlan_trunk.","type":"string"},"correlation_id":{"description":"Optional. Opaque identifier for joining the drift event with the audit job run.","type":"string"},"device":{"description":"Required. The network device where drift was observed, for example switch-access-01.example.","type":"string"},"drift_detail":{"description":"Optional. The secret-free drift summary mirroring the Ansible drift.json artifact. Each boolean is true when that resource category changed.","properties":{"acls":{"type":"boolean"},"bindings":{"type":"boolean"},"host":{"description":"Inventory hostname of the audited device.","type":"string"},"switchports":{"type":"boolean"},"vlans":{"type":"boolean"}},"required":["host"],"type":"object"},"event_type":{"const":"configuration_drift","description":"Required. Fixed value for this event family.","type":"string"},"expected_state":{"description":"Required. The state declared by the golden model.","type":"string"},"message":{"description":"Required. Human-readable summary. Must not contain secrets or private key material.","type":"string"},"observed_state":{"description":"Required. The state actually observed on the device.","type":"string"},"previous_state":{"description":"Optional. The last known good state before the drift was observed.","type":"string"},"remediation":{"description":"Required. Whether remediation was performed by the job that detected the drift.","enum":["not_performed","performed","manual"],"type":"string"},"severity":{"description":"Required. Severity assigned at the source.","enum":["low","medium","high","critical"],"type":"string"},"timestamp":{"description":"Required. RFC3339 UTC timestamp of when the drift was detected.","format":"date-time","type":"string"}},"required":["timestamp","event_type","severity","device","configuration_object","expected_state","observed_state","remediation","message"],"type":"object"}