{"configuration_object":"switchport_access_vlan","correlation_id":"drift-20260101-121500","device":"switch-access-01.example","drift_detail":{"acls":false,"bindings":false,"host":"switch-access-01.example","switchports":true,"vlans":false},"event_type":"configuration_drift","expected_state":"Gi1/0/11 access VLAN 50","message":"Access port Gi1/0/11 drifted from AI_AUTOMATION VLAN 50 to VLAN 10; audit only, no remediation performed","observed_state":"Gi1/0/11 access VLAN 10","previous_state":"Gi1/0/11 access VLAN 50","remediation":"not_performed","severity":"high","timestamp":"2026-01-01T12:15:00Z"}